{
  "version": "1.0",
  "repository": "https://github.com/djunekz/termux-app-store",
  "generated_at": "2026-05-12T11:29:41.660070+00:00",
  "total": 85,
  "packages": [
    {
      "package": "aichat",
      "version": "0.30.0",
      "maintainer": "@termux-app-store",
      "description": "All-in-one LLM CLI tool featuring Shell Assistant, Chat-REPL, RAG, AI Tools & Agents, with access to OpenAI, Claude, Gemini, Ollama, Groq, and more.",
      "homepage": "https://github.com/sigoden/aichat",
      "license": "Apache-2.0",
      "download_size": "Unknown",
      "installed_size": "Unknown",
      "source": "https://github.com/djunekz/termux-app-store",
      "srcurl": "https://github.com/sigoden/aichat/archive/refs/tags/v0.30.0.tar.gz",
      "sha256": "e194cc89afc213a6e3169738221cae641c347421c4f2aacd5d6f4f7cc6edb387",
      "platform_independent": false,
      "depends": [
        "rust"
      ]
    },
    {
      "package": "ani-cli",
      "version": "4.13",
      "maintainer": "@termux-app-store",
      "description": "A cli tool to browse and play anime",
      "homepage": "https://github.com/pystardust/ani-cli",
      "license": "GPL-3.0",
      "download_size": "Unknown",
      "installed_size": "Unknown",
      "source": "https://github.com/djunekz/termux-app-store",
      "srcurl": "https://github.com/pystardust/ani-cli/releases/download/v${TERMUX_PKG_VERSION}/ani-cli",
      "sha256": "17c8a97b034d3e48ba4663d538a5705adfbbffb951fa67650a57f7e4414959e2",
      "platform_independent": false,
      "depends": [
        "nodejs",
        "aria2",
        "ffmpeg",
        "fzf",
        "grep",
        "sed",
        "wget"
      ]
    },
    {
      "package": "aura",
      "version": "0.10.0",
      "maintainer": "@termux-app-store",
      "description": "Adaptive Unified Runtime Assistant",
      "homepage": "https://github.com/djunekz/aura",
      "license": "MIT",
      "download_size": "Unknown",
      "installed_size": "Unknown",
      "source": "https://github.com/djunekz/termux-app-store",
      "srcurl": "https://github.com/djunekz/aura/archive/refs/tags/v${TERMUX_PKG_VERSION}.zip",
      "sha256": "f9cfa5f137ad035f35faace06f00eb61d368e39c24a12521da1ff1bac235d630",
      "platform_independent": false,
      "depends": [
        "nodejs"
      ]
    },
    {
      "package": "auxscan",
      "version": "1.0.0",
      "maintainer": "@termux-app-store",
      "description": "Vulnerability Scanner to automate certain tasks",
      "homepage": "https://github.com/Gameye98/Auxscan",
      "license": "UNKNOWN",
      "download_size": "Unknown",
      "installed_size": "Unknown",
      "source": "https://github.com/djunekz/termux-app-store",
      "srcurl": "https://github.com/Gameye98/Auxscan/archive/refs/heads/master.tar.gz",
      "sha256": "fc66c68f438df226328b6a78347c9862e33b9e30e60c3e0e73b57033c60a9631",
      "platform_independent": false,
      "depends": [
        "python",
        "python-pip",
        "python-setuptools"
      ]
    },
    {
      "package": "bashxt",
      "version": "3.0",
      "maintainer": "@termux-app-store",
      "description": "basic command, code color, shortcut keyboar, etc information",
      "homepage": "https://github.com/djunekz/bashxt",
      "license": "MIT",
      "download_size": "Unknown",
      "installed_size": "Unknown",
      "source": "https://github.com/djunekz/termux-app-store",
      "srcurl": "https://github.com/djunekz/bashxt/releases/download/v${TERMUX_PKG_VERSION}/bashxt_${TERMUX_PKG_VERSION}_all.deb",
      "sha256": "12345652b542a95342c61043d426b422f2a1eced944cdaffc70efc782781231e",
      "platform_independent": false
    },
    {
      "package": "basic",
      "version": "1.2.0",
      "maintainer": "@termux-app-store",
      "description": "Simulator Terminal learning basic command for beginner",
      "homepage": "https://github.com/djunekz/basic",
      "license": "GPL-3.0",
      "download_size": "Unknown",
      "installed_size": "Unknown",
      "source": "https://github.com/djunekz/termux-app-store",
      "srcurl": "https://github.com/djunekz/basic/releases/download/${TERMUX_PKG_VERSION}/basic_${TERMUX_PKG_VERSION}_all.deb",
      "sha256": "440657aa7347b38f6dd380630f293e496954279829b0cdbd4508fbe5bfdd167d",
      "platform_independent": false,
      "depends": [
        "python"
      ]
    },
    {
      "package": "baxter",
      "version": "1.2.4",
      "maintainer": "@djunekz",
      "description": "Encrypt and decrypt files termux",
      "homepage": "https://github.com/djunekz/baxter",
      "license": "Apache-2.0",
      "download_size": "Unknown",
      "installed_size": "Unknown",
      "source": "https://github.com/djunekz/termux-app-store",
      "srcurl": "https://github.com/djunekz/baxter/releases/download/v${TERMUX_PKG_VERSION}/baxter-v${TERMUX_PKG_VERSION}.tar.gz",
      "sha256": "7fac8356d81197218f44e60e0212e12ad63ca55462f9a563b541a589319e3227",
      "platform_independent": false,
      "depends": [
        "nodejs"
      ]
    },
    {
      "package": "bing-ip2hosts",
      "version": "1.0.5",
      "maintainer": "@termux-app-store",
      "description": "bingip2hosts is a Bing.com web scraper that discovers websites by IP address",
      "homepage": "https://github.com/urbanadventurer/bing-ip2hosts",
      "license": "GPL-3.0",
      "download_size": "Unknown",
      "installed_size": "Unknown",
      "source": "https://github.com/djunekz/termux-app-store",
      "srcurl": "https://github.com/urbanadventurer/bing-ip2hosts/archive/refs/tags/v1.0.5.tar.gz",
      "sha256": "0a198af8d7876d7adb9c0517025bd6443d13399a188615a078cf3e45e120f19e",
      "platform_independent": false
    },
    {
      "package": "binwalk",
      "version": "3.1.0",
      "maintainer": "@termux-app-store",
      "description": "Firmware Analysis Tool",
      "homepage": "https://github.com/ReFirmLabs/binwalk",
      "license": "MIT",
      "download_size": "Unknown",
      "installed_size": "Unknown",
      "source": "https://github.com/djunekz/termux-app-store",
      "srcurl": "https://github.com/ReFirmLabs/binwalk/archive/refs/tags/v3.1.0.tar.gz",
      "sha256": "06f595719417b70a592580258ed980237892eadc198e02363201abe6ca59e49a",
      "platform_independent": false,
      "depends": [
        "rust"
      ]
    },
    {
      "package": "bit",
      "version": "1.1.2",
      "maintainer": "@termux-app-store",
      "description": "Bit is a modern Git CLI",
      "homepage": "https://github.com/chriswalz/bit",
      "license": "Apache-2.0",
      "download_size": "Unknown",
      "installed_size": "Unknown",
      "source": "https://github.com/djunekz/termux-app-store",
      "srcurl": "https://github.com/chriswalz/bit/archive/refs/tags/v1.1.2.tar.gz",
      "sha256": "563ae6b0fa279cb8ea8f66b4b455c7cb74a9e65a0edbe694505b2c8fc719b2ff",
      "platform_independent": false,
      "depends": [
        "golang"
      ]
    },
    {
      "package": "bower",
      "version": "1.8.12",
      "maintainer": "@termux-app-store",
      "description": "A package manager for the web",
      "homepage": "https://github.com/bower/bower",
      "license": "MIT",
      "download_size": "Unknown",
      "installed_size": "Unknown",
      "source": "https://github.com/djunekz/termux-app-store",
      "srcurl": "https://api.github.com/repos/bower/bower/tarball/v${TERMUX_PKG_VERSION}",
      "sha256": "d54d92c4a12c674e79ed38742bd82b797098c24e67391c963555cf4a23855e01",
      "platform_independent": false,
      "depends": [
        "nodejs"
      ]
    },
    {
      "package": "broot",
      "version": "1.56.2",
      "maintainer": "@termux-app-store",
      "description": "A new way to see and navigate directory trees : https://dystroy.org/broot",
      "homepage": "https://github.com/Canop/broot",
      "license": "MIT",
      "download_size": "Unknown",
      "installed_size": "Unknown",
      "source": "https://github.com/djunekz/termux-app-store",
      "srcurl": "https://github.com/Canop/broot/archive/refs/tags/v1.56.2.tar.gz",
      "sha256": "3e7be4252c76565f6d71b34bd07d26e1444b9ac2e1c8271c724f6e866fe75565",
      "platform_independent": false,
      "depends": [
        "rust"
      ]
    },
    {
      "package": "brutespray",
      "version": "2.6.0",
      "maintainer": "@termux-app-store",
      "description": "Fast, multi-protocol credential brute-forcer. Parses Nmap, Nessus, and Nexpose output to automatically test default and custom credentials across 30+ protocols.",
      "homepage": "https://pkg.go.dev/github.com/x90skysn3k/brutespray/v2",
      "license": "MIT",
      "download_size": "Unknown",
      "installed_size": "Unknown",
      "source": "https://github.com/djunekz/termux-app-store",
      "srcurl": "https://github.com/x90skysn3k/brutespray/archive/refs/tags/v2.6.0.tar.gz",
      "sha256": "cae09d60d49b46d56892caf1bab3ff56d135e9dedd110db8907ac98522327e4e",
      "platform_independent": false,
      "depends": [
        "golang"
      ]
    },
    {
      "package": "clickjacking-tester",
      "version": "1.0.0",
      "maintainer": "@termux-app-store",
      "description": "A python script designed to check if the website if vulnerable of clickjacking and create a poc",
      "homepage": "https://github.com/D4Vinci/Clickjacking-Tester",
      "license": "GPL-3.0",
      "download_size": "Unknown",
      "installed_size": "Unknown",
      "source": "https://github.com/djunekz/termux-app-store",
      "srcurl": "https://github.com/D4Vinci/Clickjacking-Tester/archive/refs/heads/master.tar.gz",
      "sha256": "21c128c44d965ee337c8f946c07144de3a2a8d14320364015312870abe2267d3",
      "platform_independent": false,
      "depends": [
        "python",
        "python-pip",
        "python-setuptools"
      ]
    },
    {
      "package": "cloudflair",
      "version": "1.0.0",
      "maintainer": "@termux-app-store",